{
  "$schema": "https://json-schema.org/draft/2020-12/schema",
  "title": "Spreadsheet Auditor Findings",
  "type": "object",
  "required": ["audit_version", "workbook", "coverage", "findings"],
  "properties": {
    "audit_version": { "type": "string" },
    "tool_version": { "type": "string" },
    "timestamp": { "type": "string", "format": "date-time" },
    "runtime": {
      "type": "object",
      "properties": {
        "python": { "type": ["string", "null"] },
        "platform": { "type": ["string", "null"] },
        "openpyxl": { "type": ["string", "null"] },
        "defusedxml": { "type": ["string", "null"] },
        "libreoffice": { "type": ["string", "null"] }
      }
    },
    "workbook": {
      "type": "object",
      "required": ["path", "sha256", "sheets_analyzed", "formulas_scanned", "recalc_status"],
      "properties": {
        "path": { "type": "string" },
        "sha256": { "type": "string" },
        "sheets_analyzed": { "type": "integer" },
        "formulas_scanned": { "type": "integer" },
        "recalc_status": { "type": "string" }
      }
    },
    "coverage": {
      "type": "object",
      "properties": {
        "macros_present": { "type": "boolean" },
        "macros_executed": { "const": false },
        "external_links_present": { "type": "boolean" },
        "unsupported_features": { "type": "array", "items": { "type": "string" } },
        "limitations": { "type": "array", "items": { "type": "string" } },
        "complete": {
          "type": "boolean",
          "description": "False when part of the workbook was not checked; the CLI then exits 6."
        },
        "incomplete": {
          "type": "array",
          "description": "Why part of the workbook was not checked. Each message also appears in limitations.",
          "items": {
            "type": "object",
            "required": ["reason", "message", "rules"],
            "properties": {
              "reason": { "enum": ["check_failed", "timeout", "formula_cap", "cell_cap"] },
              "message": { "type": "string" },
              "rules": {
                "type": "array",
                "items": { "type": "string" },
                "description": "Rules that were not checked, or were checked only in part; empty when every rule is affected."
              }
            }
          }
        },
        "recalculation": {
          "type": "object",
          "properties": {
            "status": { "type": ["string", "null"] },
            "limitations": { "type": "array", "items": { "type": "string" } }
          }
        },
        "macros": {
          "type": "object",
          "properties": {
            "present": { "type": "boolean" },
            "executed": { "const": false }
          }
        },
        "external_links": {
          "type": "object",
          "properties": {
            "present": { "type": "boolean" },
            "followed": { "const": false }
          }
        },
        "truncated": {
          "type": "object",
          "properties": {
            "formulas": { "type": "boolean" },
            "findings": { "type": "boolean" },
            "cells": { "type": "boolean" },
            "timeout": { "type": "boolean" }
          }
        }
      }
    },
    "findings": {
      "type": "array",
      "items": {
        "type": "object",
        "required": ["id", "rule_id", "severity", "error_confidence", "detection_mode", "location", "evidence", "suggested_fix", "suppressed"],
        "properties": {
          "id": { "type": "string" },
          "fingerprint": { "type": "string" },
          "rule_id": { "type": "string" },
          "severity": { "enum": ["Critical", "High", "Medium", "Low", "Info"] },
          "error_confidence": { "enum": ["Defect", "Likely defect", "Review", "Info"] },
          "confidence": { "type": "string" },
          "detection_mode": { "enum": ["DET", "HEUR"] },
          "mode": { "type": "string" },
          "location": { "type": "string" },
          "sheet": { "type": ["string", "null"] },
          "cell": { "type": ["string", "null"] },
          "range": { "type": ["string", "null"] },
          "formula": { "type": ["string", "null"] },
          "evidence": { "type": "array", "items": { "type": "string" } },
          "impact": { "type": "object" },
          "limitations": { "type": "array", "items": { "type": "string" } },
          "suggested_fix": { "type": "string" },
          "suppressed": { "type": "boolean" }
        }
      }
    }
  }
}
