{
  "audit_version": "0.4.0",
  "tool_version": "0.4.0",
  "timestamp": "2026-10-01T04:14:12+00:00",
  "runtime": {
    "python": "3.11.16",
    "platform": "Linux-6.17.0-1022-azure-x86_64-with-glibc2.39",
    "openpyxl": "3.1.5",
    "defusedxml": "0.7.1",
    "libreoffice": null
  },
  "workbook": {
    "path": "examples/demo_bad_budget.xlsx",
    "sha256": "465648d14e4be9f83fb9f1559cd3a1c02942d4a07de1049635c0967ab411835c",
    "sheets_analyzed": 2,
    "formulas_scanned": 30,
    "recalc_status": "completed"
  },
  "coverage": {
    "macros_present": false,
    "macros_executed": false,
    "external_links_present": false,
    "unsupported_features": [],
    "limitations": [],
    "complete": true,
    "incomplete": [],
    "finding_counts": {
      "total": 13,
      "shown": 13,
      "suppressed": 0,
      "by_severity": {
        "Critical": 3,
        "High": 7,
        "Medium": 3
      },
      "by_rule": [
        {
          "rule_id": "CROSS_FOOT_FAILURE",
          "severity": "Critical",
          "error_confidence": "Defect",
          "count": 1
        },
        {
          "rule_id": "LIVE_ERROR",
          "severity": "Critical",
          "error_confidence": "Defect",
          "count": 1
        },
        {
          "rule_id": "RANGE_EXCLUSION",
          "severity": "Critical",
          "error_confidence": "Likely defect",
          "count": 1
        },
        {
          "rule_id": "FORMULA_DRIFT",
          "severity": "High",
          "error_confidence": "Likely defect",
          "count": 3
        },
        {
          "rule_id": "BROKEN_REFERENCE",
          "severity": "High",
          "error_confidence": "Defect",
          "count": 1
        },
        {
          "rule_id": "HARDCODE_IN_FORMULA_BLOCK",
          "severity": "High",
          "error_confidence": "Likely defect",
          "count": 1
        },
        {
          "rule_id": "NUMBERS_STORED_AS_TEXT",
          "severity": "High",
          "error_confidence": "Likely defect",
          "count": 1
        },
        {
          "rule_id": "TOTAL_MISMATCH",
          "severity": "High",
          "error_confidence": "Likely defect",
          "count": 1
        },
        {
          "rule_id": "DUPLICATE_KEY",
          "severity": "Medium",
          "error_confidence": "Review",
          "count": 1
        },
        {
          "rule_id": "HIDDEN_STRUCTURE_IN_TOTAL",
          "severity": "Medium",
          "error_confidence": "Review",
          "count": 1
        },
        {
          "rule_id": "WHITESPACE_KEY",
          "severity": "Medium",
          "error_confidence": "Review",
          "count": 1
        }
      ]
    },
    "truncated": {
      "formulas": false,
      "findings": false,
      "cells": false,
      "timeout": false
    },
    "elapsed_seconds": 0.936,
    "recalculation": {
      "status": "completed",
      "limitations": []
    },
    "macros": {
      "present": false,
      "executed": false
    },
    "external_links": {
      "present": false,
      "followed": false
    }
  },
  "findings": [
    {
      "id": "CROSS_FOOT_FAILURE-001",
      "fingerprint": "1d6057391ddd5534",
      "rule_id": "CROSS_FOOT_FAILURE",
      "severity": "Critical",
      "error_confidence": "Defect",
      "confidence": "Defect",
      "detection_mode": "DET",
      "mode": "DET",
      "location": "Budget!E6",
      "members": [
        "Budget!E6"
      ],
      "sheet": "Budget",
      "cell": "E6",
      "range": null,
      "title": "Row totals and column totals disagree",
      "formula": null,
      "evidence": [
        "Row totals E4:E5 sum to 7015.0; column totals B6:D6 sum to 7165.0."
      ],
      "impact": {
        "estimated_delta": -150.0
      },
      "limitations": [],
      "suggested_fix": "Reconcile the totals row and totals column; one of the contributing aggregates is likely wrong.",
      "suppressed": false
    },
    {
      "id": "LIVE_ERROR-001",
      "fingerprint": "25a6f1a375234871",
      "rule_id": "LIVE_ERROR",
      "severity": "Critical",
      "error_confidence": "Defect",
      "confidence": "Defect",
      "detection_mode": "DET",
      "mode": "DET",
      "location": "Budget!B14",
      "members": [
        "Budget!B14"
      ],
      "sheet": "Budget",
      "cell": "B14",
      "range": null,
      "title": "Cell contains live spreadsheet error",
      "formula": "=SUM(#REF!)",
      "evidence": [
        "Formula contains #REF!, so the cell evaluates to that error whatever its inputs."
      ],
      "impact": {},
      "limitations": [],
      "suggested_fix": "Trace the formula precedent chain and resolve the underlying spreadsheet error.",
      "suppressed": false
    },
    {
      "id": "RANGE_EXCLUSION-001",
      "fingerprint": "bc4764157bc642c4",
      "rule_id": "RANGE_EXCLUSION",
      "severity": "Critical",
      "error_confidence": "Likely defect",
      "confidence": "Likely defect",
      "detection_mode": "DET",
      "mode": "DET",
      "location": "Budget!B10",
      "members": [
        "Budget!B10"
      ],
      "sheet": "Budget",
      "cell": "B10",
      "range": null,
      "title": "Aggregation range appears to exclude adjacent data row",
      "formula": "=SUM(B7:B8)",
      "evidence": [
        "Budget!B7:B8 stops short of Budget!B9 (value 300), which sits below the range, between it and the total."
      ],
      "impact": {},
      "limitations": [],
      "suggested_fix": "Confirm whether Budget!B9 belongs in the aggregate, then extend the range if appropriate.",
      "suppressed": false
    },
    {
      "id": "BROKEN_REFERENCE-001",
      "fingerprint": "20794961a090cc88",
      "rule_id": "BROKEN_REFERENCE",
      "severity": "High",
      "error_confidence": "Defect",
      "confidence": "Defect",
      "detection_mode": "DET",
      "mode": "DET",
      "location": "Budget!B14",
      "members": [
        "Budget!B14"
      ],
      "sheet": "Budget",
      "cell": "B14",
      "range": null,
      "title": "Formula contains deleted reference",
      "formula": "=SUM(#REF!)",
      "evidence": [
        "Formula text contains #REF!."
      ],
      "impact": {},
      "limitations": [],
      "suggested_fix": "Restore the deleted reference or rebuild the formula from intended source cells.",
      "suppressed": false
    },
    {
      "id": "FORMULA_DRIFT-001",
      "fingerprint": "84425aadc6e1a0c9",
      "rule_id": "FORMULA_DRIFT",
      "severity": "High",
      "error_confidence": "Likely defect",
      "confidence": "Likely defect",
      "detection_mode": "DET",
      "mode": "DET",
      "location": "Budget!B10",
      "members": [
        "Budget!B10"
      ],
      "sheet": "Budget",
      "cell": "B10",
      "range": null,
      "title": "Formula breaks neighboring pattern",
      "formula": "=SUM(B7:B8)",
      "evidence": [
        "Formula differs from the dominant relative pattern in this row.",
        "Dominant pattern (n=2): =SUM(R[-3]C:R[-1]C)",
        "This cell: =SUM(R[-3]C:R[-2]C)",
        "Neighboring formulas: Budget!C10==SUM(C7:C9)"
      ],
      "impact": {},
      "limitations": [],
      "suggested_fix": "If this cell is the same kind of line as its neighbors, restore their pattern. A total, net or summary line differs by design: compare it with the other totals instead.",
      "suppressed": false
    },
    {
      "id": "FORMULA_DRIFT-002",
      "fingerprint": "d2c8451808c1ab24",
      "rule_id": "FORMULA_DRIFT",
      "severity": "High",
      "error_confidence": "Likely defect",
      "confidence": "Likely defect",
      "detection_mode": "DET",
      "mode": "DET",
      "location": "Budget!B6",
      "members": [
        "Budget!B6"
      ],
      "sheet": "Budget",
      "cell": "B6",
      "range": null,
      "title": "Formula breaks neighboring pattern",
      "formula": "=SUM(B4:B5)+B5",
      "evidence": [
        "Formula differs from the dominant relative pattern in this row.",
        "Dominant pattern (n=2): =SUM(R[-2]C:R[-1]C)",
        "This cell: =SUM(R[-2]C:R[-1]C)+R[-1]C",
        "Neighboring formulas: Budget!C6==SUM(C4:C5)"
      ],
      "impact": {},
      "limitations": [],
      "suggested_fix": "If this cell is the same kind of line as its neighbors, restore their pattern. A total, net or summary line differs by design: compare it with the other totals instead.",
      "suppressed": false
    },
    {
      "id": "FORMULA_DRIFT-003",
      "fingerprint": "a5bbd2d71e743d9d",
      "rule_id": "FORMULA_DRIFT",
      "severity": "High",
      "error_confidence": "Likely defect",
      "confidence": "Likely defect",
      "detection_mode": "DET",
      "mode": "DET",
      "location": "Budget!E6",
      "members": [
        "Budget!E6"
      ],
      "sheet": "Budget",
      "cell": "E6",
      "range": null,
      "title": "Formula breaks neighboring pattern",
      "formula": "=SUM(B6:C6)",
      "evidence": [
        "Formula differs from the dominant relative pattern in this column.",
        "Dominant pattern (n=6): =SUM(RC[-3]:RC[-1])",
        "This cell: =SUM(RC[-3]:RC[-2])",
        "Neighboring formulas: Budget!E5==SUM(B5:D5); Budget!E7==SUM(B7:D7)"
      ],
      "impact": {},
      "limitations": [],
      "suggested_fix": "If this cell is the same kind of line as its neighbors, restore their pattern. A total, net or summary line differs by design: compare it with the other totals instead.",
      "suppressed": false
    },
    {
      "id": "HARDCODE_IN_FORMULA_BLOCK-001",
      "fingerprint": "24064dc98bd42f48",
      "rule_id": "HARDCODE_IN_FORMULA_BLOCK",
      "severity": "High",
      "error_confidence": "Likely defect",
      "confidence": "Likely defect",
      "detection_mode": "DET",
      "mode": "DET",
      "location": "Budget!E9",
      "members": [
        "Budget!E9"
      ],
      "sheet": "Budget",
      "cell": "E9",
      "range": null,
      "title": "Hardcoded value inside formula block",